{
  "clientKind": "ios",
  "delivery": { "provider": "relay", "mode": "foreground" },
  "availability": { "enabled": true, "notifications": "denied" },
  "capabilities": { "relayProtocols": [2], "audioFormats": [2], "decode": ["opus16k", "pcm16le16k"], "encode": ["opus16k"], "features": [] },
  "clientVersion": "1.0",
  "build": "170",
  "e2ee": {"phoneCert": "AAxvYW8tcGhvbmUtdjEAEnVfYWxpY2VBbGljZUFsaWNlMQAkNmM4ZjdlMmEtMWIzZC00ZTVmLTlhN2ItMGMxZDJlM2Y0YTViACBxj0+Knr69JfOkGf8r2FtK80Obpkpl1/woayPGBHt1gQAAAaCwhoEAkYyqWTm0l9txDwX955jXm7oIyeQCYUa7WkEJ8jublNVTnRNRVSNdtmAxfCT4hZXC0ERvS3SvjONRbI2DS38DAw==", "deviceCert": "AA1vYW8tZGV2aWNlLXYxABJ1X2FsaWNlQWxpY2VBbGljZTEAJDZjOGY3ZTJhLTFiM2QtNGU1Zi05YTdiLTBjMWQyZTNmNGE1YgADaW9zACAZGQKYchOLqEIvljv8fJEVFrq0AGgniVxK7dCcXZ6jYgAgcY9Pip6+vSXzpBn/K9hbSvNDm6ZKZdf8KGsjxgR7dYEAAAGgsIaBAGZiVLD1Yn14xQUsR8doN5HGUCPfctGOoCq4fYtto/ByWrr3xeDOoRxq38K7fQ5HTlRg1rdvtwehijMzmP/+rwk=", "encCert": "AA1vYW8tZW5ja2V5LXYxABJ1X2FsaWNlQWxpY2VBbGljZTEAJDZjOGY3ZTJhLTFiM2QtNGU1Zi05YTdiLTBjMWQyZTNmNGE1YgAg1J66ZRrwZ9gcoksYsPlWPcgOst4hclz7DmywP//6Hz4AAAGhCBKdAAAAAaGikWUAo9W7awVMLLmdWkqMBPsf8AwP7tMAJDIBbyZWPVhVV35MCwhk+X2niFfAGXBY7m0GKNaSn7NJjZVwKncoWCWgBA=="}
}
